{"schema_version":"1.0.0","case_id":"CASE-001","title":"Synthetic trace","purpose":"Test requirements","prompt":"Inspect local inputs and return the required structured observation.","input_files":["input/problem.md"],"oracle_path":"oracle.json","risk_tags":["unit_conversion"],"required_outputs":["requirements"],"grader":"DETERMINISTIC_V1","seed":20260831}
